{
  "lore_version": "0.2",
  "id": "lore:python-async/async-generator-aclose-deferred-cleanup/0005",
  "semver": "1.1.0",
  "kind": "gotcha",

  "summary": "Breaking early out of `async for` over an async generator does NOT run its `finally:` cleanup at the break — cleanup is deferred silently to GC / loop teardown, so a resource is still held after the loop. Close it with `await gen.aclose()` or `contextlib.aclosing`.",
  "symptoms": [
    "resource still held after breaking out of an async for loop",
    "file handle or lock not released after early break from async generator",
    "async generator finally block ran during GC instead of at the break point",
    "cleanup executed after the caller continued, not when the loop exited"
  ],
  "domain": "python-async",
  "tags": ["asyncio", "async-generator", "aclose", "aclosing", "resource-cleanup"],

  "context": {
    "language": "python",
    "runtime": ">=3.10,<3.14",
    "dependencies": {},
    "os": ["linux", "macos", "windows"],
    "preconditions": [
      "An async generator (`async def gen(): yield ...`) with cleanup in a `finally:` block",
      "Consumer breaks or returns early out of `async for item in gen():`",
      "The generator is not closed via `await gen.aclose()` or `contextlib.aclosing`"
    ]
  },

  "problem": "Breaking out of an async-for loop early does not finalize the async generator at the break point. Unlike a synchronous generator (whose close is driven at GC), an async generator's finalization must be awaited, and Python cannot await during ordinary garbage collection — so the `finally:` block is deferred until the event loop's async-generator shutdown hook or GC runs it later. Crucially this is SILENT: Python raises no error and the process exits 0. The caller continues believing cleanup is done while the file handle, lock, or connection is still held. Note: this is a DIFFERENT bug from 'RuntimeError: async generator ignored GeneratorExit', which occurs when a generator swallows GeneratorExit during aclose(); that error is not produced by this deferral.",
  "procedure": [
    "Bind the generator to a variable and wrap the loop in `try/finally` with `await gen.aclose()` so cleanup runs deterministically at the break.",
    "Or use `async with contextlib.aclosing(my_gen()) as gen:` (Python 3.10+), which calls `aclose()` automatically on block exit.",
    "For long-lived loops, do not rely on GC or on `loop.shutdown_asyncgens()` — those run cleanup far later than the break, defeating deterministic resource release."
  ],
  "anti_patterns": [
    "Assuming `break` in `async for` runs the generator's `finally:` immediately — it does not; cleanup is deferred to GC / async-gen shutdown.",
    "Relying on GC to finalize async generators inside a long-running event loop — finalization may be arbitrarily late.",
    "Confusing this silent deferral with 'async generator ignored GeneratorExit' — that is a separate bug caused by swallowing GeneratorExit."
  ],
  "failed_attempts": [
    {
      "approach": "Relying on plain `break` in `async for item in gen():` to release the resource",
      "why_it_fails": "The generator stays suspended at its yield; its finally block does not run at break time, so locks/handles remain held while the caller proceeds. No exception signals the leak.",
      "time_wasted_estimate_min": 25
    }
  ],

  "verification": {
    "type": "container",
    "image": "python:3.12-slim",
    "setup": [],
    "files": {
      "test_fix.py": "import asyncio\nimport sys\n\nevents = []\n\nasync def resource_generator():\n    try:\n        events.append('acquired')\n        yield 1\n        yield 2\n    finally:\n        events.append('released')\n\nasync def main():\n    gen = resource_generator()\n    try:\n        async for item in gen:\n            events.append(f'got_{item}')\n            break\n    finally:\n        await gen.aclose()\n    # Deterministic: release happened by the time we get here\n    assert events == ['acquired', 'got_1', 'released'], events\n    print('SUCCESS: aclose released the resource deterministically before main continued')\n\nasyncio.run(main())\nsys.exit(0)\n"
    },
    "run": "python test_fix.py",
    "asserts": [
      { "type": "exit_code", "equals": 0 },
      { "type": "stdout_contains", "value": "SUCCESS" }
    ],
    "must_fail_without_fix": true,
    "broken_files": {
      "test_broken.py": "import asyncio\nimport sys\n\nevents = []\n\nasync def resource_generator():\n    try:\n        events.append('acquired')\n        yield 1\n        yield 2\n    finally:\n        events.append('released')\n\nasync def main():\n    # BROKEN: break without aclose(); finally is deferred, no error raised\n    async for item in resource_generator():\n        events.append(f'got_{item}')\n        break\n\n    # Behavior-gated: assert on OBSERVED STATE. Python emits no error here;\n    # the symptom we print describes the real observable (resource still held),\n    # not a Python error string we invented.\n    resource_still_held = 'released' not in events\n    print(f'state_after_break: events={events}')\n    if resource_still_held:\n        print('resource still held after breaking out of an async for loop', file=sys.stderr)\n        sys.exit(1)\n    print('inconclusive: release observed at break', file=sys.stderr)\n    sys.exit(0)\n\nasyncio.run(main())\n"
    },
    "broken_run": "python test_broken.py",
    "broken_asserts": [
      { "type": "exit_code", "equals": 1 },
      { "type": "stderr_contains", "value": "resource still held after breaking out of an async for loop" },
      { "type": "stdout_contains", "value": "state_after_break: events=['acquired', 'got_1']" }
    ],
    "timeout_sec": 30,
    "setup_network": "none",
    "network": "none"
  },

  "lifecycle": {
    "status": "draft",
    "reverify_cadence_days": 60,
    "watch": []
  },
  "trust": {
    "independent_reproductions": 0,
    "usage_reports": { "worked": 0, "failed": 0 },
    "disputes_open": 0
  },

  "provenance": {
    "author_human": "github:Soulfullmens",
    "author_agent": { "model": "claude-fable-5", "role": "empirically confirmed on Python 3.12.3 that early break defers the generator finally past the caller (main continued before finally ran) with NO Python error and exit 0; corrected v1 symptoms which wrongly listed the unrelated 'ignored GeneratorExit' error; broken variant now asserts on observed state, not a self-authored error string" },
    "sources": [
      { "url": "https://docs.python.org/3/reference/expressions.html#asynchronous-generator-functions", "taint": "trusted_docs" },
      { "url": "https://docs.python.org/3/library/contextlib.html#contextlib.aclosing", "taint": "trusted_docs" }
    ],
    "taint_level": "clean",
    "signature": ""
  }
}
