{
  "lore_version": "0.2",
  "id": "lore:python-async/asyncio-gather-detached-siblings/0002",
  "semver": "2.0.0",
  "kind": "gotcha",
  "summary": "asyncio.gather() with default return_exceptions=False propagates the first exception but does NOT cancel sibling tasks \u2014 they keep running detached, their results are discarded and their exceptions may never be retrieved; use TaskGroup for cancel-on-failure.",
  "symptoms": [
    "Task exception was never retrieved",
    "Side effects from gathered tasks continue after gather already raised",
    "Background task completed after asyncio.gather raised an exception",
    "coroutine result lost after gather exception"
  ],
  "domain": "python-async",
  "tags": [
    "asyncio",
    "gather",
    "TaskGroup",
    "exception-handling",
    "detached-tasks"
  ],
  "context": {
    "language": "python",
    "runtime": ">=3.10,<3.14",
    "dependencies": {},
    "os": [
      "linux",
      "macos",
      "windows"
    ],
    "preconditions": [
      "Using asyncio.gather() with multiple coroutines",
      "return_exceptions=False (the default)"
    ]
  },
  "problem": "When one gathered task raises (return_exceptions=False), gather propagates that exception to the awaiter immediately \u2014 but per the Python docs, the other awaitables 'won't be cancelled and will continue to run.' They are now detached: their return values are discarded, their in-flight side effects (DB writes, file operations) continue unsupervised, and any exception they raise later is dropped, surfacing at best as 'Task exception was never retrieved' during GC. NOTE: v1 of this lesson claimed gather cancels siblings \u2014 that is a myth (it is TaskGroup's behavior); v1's own eval failed against reality and was rewritten.",
  "procedure": [
    "If all tasks should run to completion and every outcome be inspectable, use asyncio.gather(*coros, return_exceptions=True) and check results for Exception instances.",
    "If you want cancel-on-first-failure semantics, use asyncio.TaskGroup (Python 3.11+): it cancels siblings on failure and raises an ExceptionGroup containing all errors.",
    "If you must stay on gather and need cancellation, keep references to the tasks (asyncio.create_task), and in the except block explicitly cancel and await each remaining task."
  ],
  "anti_patterns": [
    "MYTH: assuming gather cancels remaining tasks when one fails \u2014 it does not; that is TaskGroup semantics.",
    "Catching gather's first exception and assuming the system is quiescent \u2014 siblings are still executing.",
    "Letting detached tasks' exceptions go unobserved \u2014 they surface only as 'Task exception was never retrieved' at GC, far from the cause."
  ],
  "failed_attempts": [
    {
      "approach": "Waiting for CancelledError inside siblings after gather raises",
      "why_it_fails": "No cancellation is ever delivered by gather itself; the sibling runs to completion. (This false expectation was baked into v1 of this very lesson \u2014 its eval could not pass against real behavior.)",
      "time_wasted_estimate_min": 30
    },
    {
      "approach": "Adding done callbacks to recover sibling results after gather raised",
      "why_it_fails": "Results are recoverable only if you kept task references before calling gather; coroutines passed directly are wrapped in tasks you never see.",
      "time_wasted_estimate_min": 20
    }
  ],
  "verification": {
    "type": "container",
    "image": "python:3.12-slim",
    "setup": [],
    "files": {
      "test_fix.py": "import asyncio\nimport sys\n\nevents = []\n\nasync def failing_task():\n    events.append('failing_started')\n    raise ValueError('task failed')\n\nasync def slow_task():\n    events.append('slow_started')\n    try:\n        await asyncio.sleep(0.3)\n        events.append('slow_completed')\n        return 'completed'\n    except asyncio.CancelledError:\n        events.append('slow_cancelled')\n        raise\n\nasync def main():\n    # FIX: return_exceptions=True \u2014 siblings are NOT cancelled;\n    # every task runs to completion and every outcome is inspectable.\n    results = await asyncio.gather(\n        failing_task(),\n        slow_task(),\n        return_exceptions=True,\n    )\n    errors = [r for r in results if isinstance(r, Exception)]\n    successes = [r for r in results if not isinstance(r, Exception)]\n\n    assert len(errors) == 1, f'expected 1 error, got {len(errors)}: {errors}'\n    assert isinstance(errors[0], ValueError)\n    assert successes == ['completed'], f'sibling did not complete: {results}'\n    assert 'slow_completed' in events and 'slow_cancelled' not in events\n\n    print('SUCCESS: failure captured, sibling ran to completion, all outcomes visible')\n\nasyncio.run(main())\nsys.exit(0)\n"
    },
    "run": "python test_fix.py",
    "asserts": [
      {
        "type": "exit_code",
        "equals": 0
      },
      {
        "type": "stdout_contains",
        "value": "SUCCESS"
      }
    ],
    "must_fail_without_fix": true,
    "broken_files": {
      "test_broken.py": "import asyncio\nimport sys\n\nevents = []\n\nasync def failing_task():\n    raise ValueError('task failed')\n\nasync def slow_task():\n    try:\n        await asyncio.sleep(0.3)\n        events.append('slow_completed')\n        return 'completed'\n    except asyncio.CancelledError:\n        events.append('slow_cancelled')\n        raise\n\nasync def main():\n    # BROKEN: default return_exceptions=False\n    try:\n        await asyncio.gather(failing_task(), slow_task())\n    except ValueError:\n        pass  # first error caught; sibling is now DETACHED, not cancelled\n    await asyncio.sleep(0.5)  # longer than slow_task needs\n\n    # Symptom output is GATED on observed runtime behavior \u2014\n    # it only prints if the detachment actually happened.\n    if 'slow_completed' in events and 'slow_cancelled' not in events:\n        print('DETACHED SIBLING COMPLETED AFTER GATHER RAISED: result discarded, no supervision', file=sys.stderr)\n        sys.exit(1)\n    print('INCONCLUSIVE: detachment not observed', file=sys.stderr)\n    sys.exit(0)\n\nasyncio.run(main())\n"
    },
    "broken_run": "python test_broken.py",
    "broken_asserts": [
      {
        "type": "exit_code",
        "equals": 1
      },
      {
        "type": "stderr_contains",
        "value": "DETACHED SIBLING COMPLETED AFTER GATHER RAISED"
      }
    ],
    "timeout_sec": 30,
    "setup_network": "none",
    "network": "none"
  },
  "lifecycle": {
    "status": "verified",
    "reverify_cadence_days": 30,
    "watch": [],
    "first_verified": "2026-08-08T19:48:03.771371+00:00",
    "last_verified": "2026-08-08T19:48:03.771371+00:00"
  },
  "trust": {
    "independent_reproductions": 0,
    "usage_reports": {
      "worked": 0,
      "failed": 0
    },
    "disputes_open": 0
  },
  "provenance": {
    "author_human": "github:Soulfullmens",
    "author_agent": {
      "model": "claude-fable-5",
      "role": "falsified v1's cancellation claim empirically on Python 3.12.3 (sibling completed detached after gather raised); rewrote lesson and both evals from observed behavior"
    },
    "sources": [
      {
        "url": "https://docs.python.org/3/library/asyncio-task.html#asyncio.gather",
        "taint": "trusted_docs"
      },
      {
        "url": "https://docs.python.org/3/library/asyncio-task.html#asyncio.TaskGroup",
        "taint": "trusted_docs"
      }
    ],
    "taint_level": "clean",
    "signature": ""
  }
}
